{
  "$schema": "https://json-schema.org/draft/2020-12/schema",
  "title": "CiTT Circuit Spec",
  "type": "object",
  "required": [
    "circuit_type",
    "components",
    "connections",
    "nodes",
    "ground_node",
    "sources",
    "requested_outputs",
    "assumptions",
    "ambiguities",
    "unsupported_or_unclear_regions",
    "suggested_simscape_blocks",
    "likely_analysis",
    "focus_points"
  ],
  "properties": {
    "circuit_type": { "type": "string" },
    "components": {
      "type": "array",
      "items": {
        "type": "object",
        "required": ["id", "type", "label", "value", "unit", "terminals", "confidence"],
        "properties": {
          "id": { "type": "string" },
          "type": { "type": "string" },
          "label": { "type": "string" },
          "value": {},
          "unit": { "type": "string" },
          "terminals": { "type": "array", "items": { "type": "string" } },
          "confidence": { "type": "number", "minimum": 0, "maximum": 1 }
        }
      }
    },
    "nodes": { "type": "array", "items": { "type": "string" } },
    "connections": {
      "type": "array",
      "items": {
        "type": "object",
        "required": ["from", "to", "label", "confidence"],
        "properties": {
          "from": { "type": "string" },
          "to": { "type": "string" },
          "label": { "type": "string" },
          "confidence": { "type": "number", "minimum": 0, "maximum": 1 }
        }
      }
    },
    "ground_node": { "type": "string" },
    "sources": { "type": "array" },
    "requested_outputs": { "type": "array" },
    "likely_analysis": { "type": "string" },
    "assumptions": { "type": "array", "items": { "type": "string" } },
    "ambiguities": { "type": "array", "items": { "type": "string" } },
    "unsupported_or_unclear_regions": { "type": "array", "items": { "type": "string" } },
    "suggested_simscape_blocks": { "type": "array", "items": { "type": "string" } },
    "digital_or_state_logic": {
      "type": "array",
      "items": {
        "type": "object",
        "properties": {
          "id": { "type": "string" },
          "type": { "type": "string" },
          "inputs": { "type": "array", "items": { "type": "string" } },
          "outputs": { "type": "array", "items": { "type": "string" } },
          "states": { "type": "array", "items": { "type": "string" } },
          "teaching_reason": { "type": "string" }
        }
      }
    },
    "focus_points": {
      "type": "array",
      "items": {
        "type": "object",
        "required": ["id", "label", "reason", "related_components", "related_nodes", "teaching_question"],
        "properties": {
          "id": { "type": "string" },
          "label": { "type": "string" },
          "reason": { "type": "string" },
          "related_components": { "type": "array", "items": { "type": "string" } },
          "related_nodes": { "type": "array", "items": { "type": "string" } },
          "teaching_question": { "type": "string" }
        }
      }
    },
    "teaching_focus_points": { "$ref": "#/properties/focus_points" }
  }
}
