{
  "circuit_type": "mixed-signal electrochemical biosensor front end driven by one-compartment oral pharmacokinetic concentration profile",
  "components": [
    {
      "id": "SRC_PK",
      "type": "signal_source",
      "label": "one-compartment oral PK concentration profile C(t)",
      "value": [],
      "unit": "uM",
      "terminals": [
        "c_out"
      ],
      "confidence": 0.98
    },
    {
      "id": "LAG_M",
      "type": "first_order_lag",
      "label": "membrane mass-transfer lag tau_m",
      "value": 4,
      "unit": "s",
      "terminals": [
        "c_in",
        "c_lag_out"
      ],
      "confidence": 0.99
    },
    {
      "id": "GAIN_SENS",
      "type": "concentration_to_current_gain",
      "label": "electrochemical sensor sensitivity",
      "value": 25,
      "unit": "nA/uM",
      "terminals": [
        "c_lag_in",
        "i_cmd_out"
      ],
      "confidence": 0.99
    },
    {
      "id": "I_SENSOR",
      "type": "controlled_current_source",
      "label": "biosensor faradaic current source driven by lagged concentration",
      "value": [],
      "unit": "A",
      "terminals": [
        "p",
        "n",
        "ctrl"
      ],
      "confidence": 0.95
    },
    {
      "id": "U_TIA",
      "type": "operational_amplifier",
      "label": "transimpedance amplifier op amp",
      "value": [],
      "unit": "",
      "terminals": [
        "noninverting",
        "inverting",
        "output",
        "v_plus",
        "v_minus"
      ],
      "confidence": 0.92
    },
    {
      "id": "RF",
      "type": "resistor",
      "label": "TIA feedback resistor Rf",
      "value": 1.0E+6,
      "unit": "Ohm",
      "terminals": [
        "out",
        "sum"
      ],
      "confidence": 0.99
    },
    {
      "id": "CF",
      "type": "capacitor",
      "label": "TIA feedback capacitor Cf",
      "value": 1E-8,
      "unit": "F",
      "terminals": [
        "out",
        "sum"
      ],
      "confidence": 0.99
    },
    {
      "id": "ADC1",
      "type": "analog_to_digital_converter",
      "label": "12-bit ADC",
      "value": 12,
      "unit": "bits",
      "terminals": [
        "analog_in",
        "digital_out",
        "v_ref_hi",
        "v_ref_lo"
      ],
      "confidence": 0.96
    },
    {
      "id": "VREF",
      "type": "voltage_reference",
      "label": "TIA non-inverting/reference voltage",
      "value": 0,
      "unit": "V",
      "terminals": [
        "ref",
        "gnd"
      ],
      "confidence": 0.75
    },
    {
      "id": "VSUP",
      "type": "voltage_supply",
      "label": "op amp and ADC supply rails",
      "value": [],
      "unit": "V",
      "terminals": [
        "v_plus",
        "v_minus",
        "gnd"
      ],
      "confidence": 0.62
    }
  ],
  "nodes": [
    "n_concentration_C",
    "n_concentration_lagged",
    "n_sensor_current_cmd",
    "n_tia_sum",
    "n_tia_out",
    "n_adc_in",
    "n_adc_code",
    "n_ref",
    "n_gnd",
    "n_vplus",
    "n_vminus"
  ],
  "connections": [
    {
      "from": "SRC_PK.c_out",
      "to": "LAG_M.c_in",
      "label": "PK concentration C(t) feeds membrane lag",
      "confidence": 0.99
    },
    {
      "from": "LAG_M.c_lag_out",
      "to": "GAIN_SENS.c_lag_in",
      "label": "lagged concentration drives sensitivity conversion",
      "confidence": 0.99
    },
    {
      "from": "GAIN_SENS.i_cmd_out",
      "to": "I_SENSOR.ctrl",
      "label": "sensor current command equals 25 nA/uM times lagged concentration",
      "confidence": 0.99
    },
    {
      "from": "I_SENSOR.p",
      "to": "n_tia_sum",
      "label": "sensor current injected into TIA summing junction",
      "confidence": 0.9
    },
    {
      "from": "I_SENSOR.n",
      "to": "n_ref",
      "label": "sensor current returns to electrochemical reference node",
      "confidence": 0.82
    },
    {
      "from": "U_TIA.inverting",
      "to": "n_tia_sum",
      "label": "op amp inverting input is virtual-ground summing node",
      "confidence": 0.95
    },
    {
      "from": "U_TIA.noninverting",
      "to": "n_ref",
      "label": "op amp non-inverting input tied to reference voltage",
      "confidence": 0.93
    },
    {
      "from": "RF.out",
      "to": "n_tia_out",
      "label": "feedback resistor output terminal",
      "confidence": 0.99
    },
    {
      "from": "RF.sum",
      "to": "n_tia_sum",
      "label": "feedback resistor summing-node terminal",
      "confidence": 0.99
    },
    {
      "from": "CF.out",
      "to": "n_tia_out",
      "label": "feedback capacitor output terminal",
      "confidence": 0.99
    },
    {
      "from": "CF.sum",
      "to": "n_tia_sum",
      "label": "feedback capacitor summing-node terminal",
      "confidence": 0.99
    },
    {
      "from": "U_TIA.output",
      "to": "n_tia_out",
      "label": "TIA output node",
      "confidence": 0.99
    },
    {
      "from": "n_tia_out",
      "to": "ADC1.analog_in",
      "label": "TIA output feeds ADC input",
      "confidence": 0.97
    },
    {
      "from": "ADC1.digital_out",
      "to": "n_adc_code",
      "label": "quantized ADC output code",
      "confidence": 0.96
    },
    {
      "from": "VREF.ref",
      "to": "n_ref",
      "label": "reference node for TIA and electrochemical cell",
      "confidence": 0.86
    },
    {
      "from": "VREF.gnd",
      "to": "n_gnd",
      "label": "reference source return",
      "confidence": 0.86
    },
    {
      "from": "VSUP.v_plus",
      "to": "U_TIA.v_plus",
      "label": "positive op amp supply",
      "confidence": 0.72
    },
    {
      "from": "VSUP.v_minus",
      "to": "U_TIA.v_minus",
      "label": "negative op amp supply or ground rail",
      "confidence": 0.72
    }
  ],
  "ground_node": "n_gnd",
  "sources": [
    {
      "id": "SRC_PK",
      "type": "one_compartment_oral_pk_profile",
      "label": "C(t) concentration input",
      "value": [],
      "unit": "uM",
      "known_parameters": [],
      "missing_parameters": [
        "dose",
        "bioavailability",
        "absorption_rate_constant_ka",
        "elimination_rate_constant_ke",
        "volume_of_distribution_or_scale_factor"
      ]
    },
    {
      "id": "VREF",
      "type": "voltage_reference",
      "label": "TIA reference voltage",
      "value": 0,
      "unit": "V"
    },
    {
      "id": "VSUP",
      "type": "voltage_supply",
      "label": "op amp/ADC rails",
      "value": [],
      "unit": "V"
    }
  ],
  "requested_outputs": [
    "concentration C(t)",
    "lagged concentration after membrane mass transfer",
    "sensor current",
    "TIA output voltage",
    "ADC output code",
    "settling error"
  ],
  "likely_analysis": "time-domain transient simulation of PK-driven sensor current, first-order membrane lag, TIA response, and ADC quantization/saturation behavior",
  "assumptions": [
    "No image was attached; the specification is parsed from the student prompt only.",
    "The electrochemical biosensor is modeled as a concentration-controlled current source rather than detailed electrode kinetics.",
    "The membrane lag is modeled as a first-order transfer function with tau_m = 4 s before current generation.",
    "The TIA uses Rf and Cf in parallel from output to inverting input.",
    "The op amp is represented with a generic or idealized op amp unless supply limits, bandwidth, input noise, and output swing are later specified.",
    "The ADC input is driven directly by the TIA output.",
    "Settling error is interpreted as the difference between instantaneous measured signal and the expected steady-state value after membrane/TIA dynamics."
  ],
  "ambiguities": [
    "PK profile numerical parameters are not provided: dose, ka, ke, bioavailability, volume/scale, and initial condition are needed to generate a specific C(t).",
    "ADC reference voltage, input range, sampling rate, and saturation limits are not specified.",
    "Op amp supply rails, rail-to-rail behavior, bandwidth, input bias current, and noise model are not specified.",
    "The sign convention for sensor current and resulting TIA output polarity is not explicitly stated.",
    "Whether the TIA reference should be true ground or a mid-supply virtual reference is not specified.",
    "Noise tradeoff is requested for teaching, but no noise density or op amp/current-source noise parameters are specified."
  ],
  "unsupported_or_unclear_regions": [],
  "suggested_simscape_blocks": [
    "Simulink MATLAB Function or Transfer Fcn for one-compartment oral PK C(t)",
    "Simulink Transfer Fcn or Simscape PS Transfer Function for membrane lag",
    "Simulink-PS Converter",
    "Controlled Current Source",
    "Electrical Reference",
    "Operational Amplifier or finite-gain op amp equivalent",
    "Resistor",
    "Capacitor",
    "Voltage Source or DC Voltage Source for reference/supplies",
    "Voltage Sensor",
    "Current Sensor",
    "PS-Simulink Converter",
    "Quantizer or ADC block from Mixed-Signal Blockset if available",
    "Saturation block for ADC input range",
    "Scope/To Workspace blocks for probes"
  ],
  "focus_points": [
    {
      "id": "FP_PK_INPUT",
      "label": "PK concentration input",
      "reason": "This is the upstream physiological/pharmacokinetic driver for the entire front end.",
      "related_components": [
        "SRC_PK"
      ],
      "related_nodes": [
        "n_concentration_C"
      ],
      "teaching_question": "How do absorption and elimination rates shape the concentration waveform that the sensor must track?"
    },
    {
      "id": "FP_MEMBRANE_LAG",
      "label": "membrane mass-transfer lag",
      "reason": "The first-order lag separates true concentration from sensed concentration and creates settling error.",
      "related_components": [
        "LAG_M"
      ],
      "related_nodes": [
        "n_concentration_C",
        "n_concentration_lagged"
      ],